{
  "guestId": "test-approval-001",
  "guestName": "Max Mustermann",
  "guestEmail": "ANDREAS_EMAIL_HIER_EINSETZEN",
  "guestCompany": "Cyber Group",
  "guestRole": "Marketing Lead",
  "guestBio": "Podcast Gast zum Thema AI & Automation",
  "guestStory": "Wie Unternehmen operative Prozesse automatisieren können",
  "guestFit": "Sehr guter Fit für Business Automation Themen",
  "website": "",
  "submittedAt": "2026-05-26T14:00:00Z"
}
